{
  "schema_version": "amy.rg006-contract-test-record.v2-draft",
  "classification": "pre_registration_synthetic_runner_contract_test_not_confirmatory",
  "started_at": "2026-07-15T02:18:25.821619Z",
  "ended_at": "2026-07-15T02:18:26.437730Z",
  "command": [
    "/Volumes/Ganador disk/A.M.Y/experiments/verifiable_release_study/.venv/bin/python",
    "-m",
    "pytest",
    "-q",
    "tests/test_confirmatory_runner_contract.py"
  ],
  "environment": {
    "python": "3.12.12",
    "python_implementation": "CPython",
    "platform": "macOS-26.5.2-arm64-arm-64bit",
    "machine": "arm64"
  },
  "source_inventory": [
    {
      "path": "amy_verifier/confirmatory_runner.py",
      "bytes": 61533,
      "sha256": "54c62cdde733d8963f322fe2ab1e19df5a04ad638fdbbd4dbe78370d9ef7126e"
    },
    {
      "path": "protocol/CONFIRMATORY_RUNNER_CONTRACT_DRAFT.md",
      "bytes": 14553,
      "sha256": "aef1b6fa649265ed76c29d8a23b0963236ade59c801e7ad73d1dd25c43149aa4"
    },
    {
      "path": "protocol/RUN_EXECUTION_POLICY_DRAFT.json",
      "bytes": 18606,
      "sha256": "d604e95df84608575e52ad22754bda5e68d75df7ec683cfaf47468491aa45b12"
    },
    {
      "path": "pyproject.toml",
      "bytes": 497,
      "sha256": "8d1042a03fe74f320d6b71ee80a05da3e7e190bd64808914c5bf05460ec86af0"
    },
    {
      "path": "schemas/environment-attempt-record.schema.json",
      "bytes": 19285,
      "sha256": "1131d69e94198b561c7aed87b1a2f0ad5e076558999621fec0cd358f830475e2"
    },
    {
      "path": "schemas/infrastructure-classification.schema.json",
      "bytes": 19122,
      "sha256": "529c47e5e2f40a9bc9319cbf37c3be340dd8fdef841f701cc80fabb9787dcd6d"
    },
    {
      "path": "schemas/official-attempt-selection.schema.json",
      "bytes": 19993,
      "sha256": "475578a6e4a9da418529e68f35b79f94f7a67797dd7da01393a68d26cf071786"
    },
    {
      "path": "schemas/process-isolation-record.schema.json",
      "bytes": 11263,
      "sha256": "5d7966c7715e8961ef0fe680a3383368f3669eae88e045d6684a39e8635d385a"
    },
    {
      "path": "schemas/rg006-contract-test-record-v2.schema.json",
      "bytes": 10262,
      "sha256": "3dc0e4f1b0264572507a70f31ecbb800c486ab0600e0dc87a1937728934231d8"
    },
    {
      "path": "schemas/run-execution-policy-validation.schema.json",
      "bytes": 3403,
      "sha256": "da08dceed2adb050b769414df05b48daebc4d0effa1856b3c5d5e4d4d404155c"
    },
    {
      "path": "schemas/run-execution-policy.schema.json",
      "bytes": 21133,
      "sha256": "264f6628b23570001308ebf3dc77f427e3ea62061db0b9fd1038487f90fb8a61"
    },
    {
      "path": "scripts/run_rg006_contract_tests.py",
      "bytes": 10683,
      "sha256": "3b358bbd805ee32e45ddac50bfa4f2ebd9fb1e081ff4f2963c6e9515ca6d6fca"
    },
    {
      "path": "scripts/validate_run_execution_policy.py",
      "bytes": 40940,
      "sha256": "4f616688951e71b426dec3fa577ee86839baa6923de851930f4b45e0c67b8a3b"
    },
    {
      "path": "tests/test_confirmatory_runner_contract.py",
      "bytes": 43640,
      "sha256": "14fdce83fcd55f1e48038ad7764f8d6c2b746bafd11b73d4a259157dffb96d58"
    },
    {
      "path": "tests/test_run_execution_policy.py",
      "bytes": 9738,
      "sha256": "0d1521c1d4905e70e082f06ce64c2a5c7ad246459f98b665d044ba92d92c9100"
    },
    {
      "path": "uv.lock",
      "bytes": 74227,
      "sha256": "ada446114e2534983167988f875dea92b5d1d895a6a12a9db70e63626a3d9f41"
    }
  ],
  "source_inventory_pre_sha256": "f34dd3d3b01d935a92b905efd9510a3e22500c3bfdbd4f8223b6d1edf307274b",
  "source_inventory_post_sha256": "f34dd3d3b01d935a92b905efd9510a3e22500c3bfdbd4f8223b6d1edf307274b",
  "source_inventory_unchanged_during_execution": true,
  "execution": {
    "exit_code": 0,
    "stdout": "....................................................                     [100%]\n52 passed in 0.43s\n",
    "stdout_sha256": "cb703438126e23990a481621ee0b08fbd411ab29ab749f557ac18210425570a4",
    "stderr": "",
    "stderr_sha256": "e3b0c44298fc1c149afbf4c8996fb92427ae41e4649b934ca495991b7852b855",
    "passed_test_count": 52
  },
  "declared_coverage": {
    "attempt_truth_table_cell_count": 12,
    "required_environment_count": 2,
    "subprocess_contract_tested": true,
    "raw_byte_stream_limits_tested": true,
    "descriptor_and_environment_canaries_tested": true,
    "no_overwrite_tested": true,
    "campaign_selection_tested": true,
    "later_attempt_campaign_seal_tested": true,
    "attempt_process_consistency_tested": true,
    "inherited_capture_pipe_deadline_tested": true,
    "exact_record_hash_recomputation_tested": true,
    "source_inventory_toctou_rejection_tested": true,
    "typed_run_policy_bindings_verified": true,
    "runner_contract_bound_source_count": 15,
    "storage_errno_fault_cell_count": 12,
    "storage_eintr_transient_cell_count": 4,
    "storage_eintr_persistent_cell_count": 3,
    "storage_process_crash_cell_count": 3,
    "same_uid_entry_substitution_tested": true,
    "atomic_noreplace_rename_tested": true,
    "fault_injection_scope": "atomic_jcs_publication_only_not_all_runner_persistence_boundaries"
  },
  "control_statuses": {
    "DURABLE_SCIENTIFIC_INTENT_LOG": {
      "status": "OPEN",
      "evidence_paths": [],
      "limitations": [
        "No complete closing evidence is retained for this control."
      ]
    },
    "CAPABILITY_SEPARATED_OUTCOME_VAULT": {
      "status": "OPEN",
      "evidence_paths": [],
      "limitations": [
        "No complete closing evidence is retained for this control."
      ]
    },
    "FULL_PROCESS_TREE_CONTAINMENT": {
      "status": "OPEN",
      "evidence_paths": [],
      "limitations": [
        "No complete closing evidence is retained for this control."
      ]
    },
    "OS_ENFORCED_OFFLINE_BOUNDARY": {
      "status": "OPEN",
      "evidence_paths": [],
      "limitations": [
        "No complete closing evidence is retained for this control."
      ]
    },
    "CRASH_AND_STORAGE_FAULT_INJECTION": {
      "status": "PARTIAL",
      "evidence_paths": [
        "amy_verifier/confirmatory_runner.py",
        "tests/test_confirmatory_runner_contract.py"
      ],
      "limitations": [
        "Coverage is limited to atomic JCS publication under synthetic errno injection and process crash; full runner persistence boundaries, recovery, power-loss durability, and cross-filesystem equivalence remain unestablished."
      ]
    },
    "BASE_AWARE_CASE_GENERATOR": {
      "status": "OPEN",
      "evidence_paths": [],
      "limitations": [
        "No complete closing evidence is retained for this control."
      ]
    },
    "ALL_PROFILE_CHILD_ADAPTERS": {
      "status": "OPEN",
      "evidence_paths": [],
      "limitations": [
        "No complete closing evidence is retained for this control."
      ]
    },
    "CAMPAIGN_SEAL_TO_LEDGER_LINK": {
      "status": "OPEN",
      "evidence_paths": [],
      "limitations": [
        "No complete closing evidence is retained for this control."
      ]
    },
    "EXTERNAL_SELECTION_AUTHENTICATION": {
      "status": "OPEN",
      "evidence_paths": [],
      "limitations": [
        "No complete closing evidence is retained for this control."
      ]
    },
    "QUALIFIED_INDEPENDENT_HUMAN_REVIEW": {
      "status": "OPEN",
      "evidence_paths": [],
      "limitations": [
        "No complete closing evidence is retained for this control."
      ]
    },
    "R0_FREEZE_AND_REGISTRATION": {
      "status": "OPEN",
      "evidence_paths": [],
      "limitations": [
        "No complete closing evidence is retained for this control."
      ]
    }
  },
  "boundaries": {
    "confirmatory_execution_performed": false,
    "confirmatory_outputs_read": false,
    "benchmark_cases_generated": false,
    "oracle_join_performed": false,
    "production_sigstore_conformance_established": false,
    "network_isolation_established": false,
    "full_process_tree_containment_established": false,
    "external_selection_authentication_established": false,
    "independent_review_performed": false,
    "power_loss_durability_established": false,
    "cross_filesystem_equivalence_established": false,
    "storage_recovery_implemented": false
  },
  "decision": "NO-GO",
  "open_controls": [
    "DURABLE_SCIENTIFIC_INTENT_LOG",
    "CAPABILITY_SEPARATED_OUTCOME_VAULT",
    "FULL_PROCESS_TREE_CONTAINMENT",
    "OS_ENFORCED_OFFLINE_BOUNDARY",
    "CRASH_AND_STORAGE_FAULT_INJECTION",
    "BASE_AWARE_CASE_GENERATOR",
    "ALL_PROFILE_CHILD_ADAPTERS",
    "CAMPAIGN_SEAL_TO_LEDGER_LINK",
    "EXTERNAL_SELECTION_AUTHENTICATION",
    "QUALIFIED_INDEPENDENT_HUMAN_REVIEW",
    "R0_FREEZE_AND_REGISTRATION"
  ],
  "rg006_complete": false,
  "manuscript_claims_authorized": false
}
